{
  "schema_version": 1,
  "host_line": "kim-android-1",
  "min_host_version_code": 1,
  "max_host_version_code": 99,
  "engine_build_id": "3.47.2",
  "logic_version": "20260905.1",
  "abi": "arm64-v8a",
  "channel": "dev",
  "created_at": "2026-09-05T12:00:00Z",
  "zip_sha256": "0123456789abcdef0123456789abcdef0123456789abcdef0123456789abcdef",
  "artifacts": [
    {
      "name": "libapp.so",
      "sha256": "aaaaaaaaaaaaaaaaaaaaaaaaaaaaaaaaaaaaaaaaaaaaaaaaaaaaaaaaaaaaaaaa",
      "size": 1048576
    },
    {
      "name": "libkim_client_ffi.so",
      "sha256": "bbbbbbbbbbbbbbbbbbbbbbbbbbbbbbbbbbbbbbbbbbbbbbbbbbbbbbbbbbbbbbbb",
      "size": 2097152
    }
  ],
  "notes": "Example only — replace hashes with pack_logic_ota.sh output."
}
